{
  "schema_version": "1.0",
  "provider_profile_id": "provider-profile:cloudflare-workers-ai-free-nemotron-3-super",
  "provider_identity_ref": "provider-id:cloudflare-workers-ai",
  "transport_profile_ref": "transport-profile:cloudflare-workers-ai-https-openai-v1",
  "credential_profile_ref": "credential-profile:cloudflare-workers-ai-api-token",
  "data_policy_ref": "data-policy:cloudflare-public-synthetic-no-storage",
  "allowed_data_classifications": [
    "PUBLIC"
  ],
  "allowed_capabilities": [
    "LOCAL_TOOL_REQUEST",
    "REASONING",
    "TEXT_GENERATION"
  ],
  "quota_policy_ref": "quota-policy:cloudflare-workers-free-nemotron-3-super",
  "budget_policy_ref": "budget-policy:cloudflare-zero",
  "money_ceiling": 0,
  "kill_switch_ref": "kill-switch:studio-owner-cloudflare",
  "incident_response_ref": "incident:cloudflare-workers-ai-provider",
  "rollback_ref": "rollback:manual-fake",
  "owner_approval_ref": "owner-approval:studio-009p-02-contract",
  "status": "DISABLED",
  "not_before": "2026-09-03T16:51:18Z",
  "expires_at": "2027-09-03T16:51:18Z",
  "as_of": "2026-09-03T16:52:00Z",
  "canonical_digest": "sha256:c861aae85aed5600bdc7e33acb11c29958667a32dab487a4c095670a438cabf2"
}
