{
  "schema_version": "1.0",
  "provider_profile_id": "provider-profile:nvidia-nim-free-deepseek-v4-pro-0813",
  "provider_identity_ref": "provider-id:nvidia-nim-api-catalog",
  "transport_profile_ref": "transport-profile:nvidia-nim-https-openai-v1",
  "credential_profile_ref": "credential-profile:nvidia-nim-api-key",
  "data_policy_ref": "data-policy:nvidia-nim-public-synthetic-trial",
  "allowed_data_classifications": [
    "PUBLIC"
  ],
  "allowed_capabilities": [
    "REASONING",
    "TEXT_GENERATION"
  ],
  "quota_policy_ref": "quota-policy:nvidia-nim-trial-dynamic",
  "budget_policy_ref": "budget-policy:nvidia-nim-zero",
  "money_ceiling": 0,
  "kill_switch_ref": "kill-switch:studio-owner-nvidia-nim",
  "incident_response_ref": "incident:nvidia-nim-provider",
  "rollback_ref": "rollback:manual-fake",
  "owner_approval_ref": "owner-approval:studio-009p-03-contract",
  "status": "DISABLED",
  "not_before": "2026-09-08T10:09:56Z",
  "expires_at": "2027-09-08T10:09:56Z",
  "as_of": "2026-09-08T10:10:00Z",
  "canonical_digest": "sha256:4c7603b4feb67ae288e5d383a27c4cdf75eb79fc38d0ffe091e8870b05e6eb62"
}
